{"$id":"https://almsivi.invalid/schemas/patch-manifest.schema.json","$schema":"https://json-schema.org/draft/2020-12/schema","additionalProperties":false,"properties":{"changes":{"items":{"additionalProperties":false,"properties":{"artifact":{"minLength":1,"type":"string"},"artifact_sha256":{"pattern":"^[0-9a-f]{64}$","type":"string"},"base_blob":{"type":["string","null"]},"operation":{"enum":["add","modify","delete"]},"order":{"type":"integer"},"path":{"minLength":1,"type":"string"},"provenance_id":{"minLength":1,"type":"string"},"rationale":{"minLength":1,"type":"string"},"result_sha256":{"type":["string","null"]},"subsystem":{"minLength":1,"type":"string"},"test_ids":{"items":{"minLength":1,"type":"string"},"minItems":1,"type":"array"}},"required":["order","path","operation","base_blob","result_sha256","artifact","artifact_sha256","rationale","subsystem","provenance_id","test_ids"],"type":"object"},"type":"array"},"schema_version":{"const":1},"series":{"items":{"minLength":1,"type":"string"},"type":"array"},"upstream":{"additionalProperties":false,"properties":{"commit":{"const":"f4bec41444214a7903bebd178389ca22ca13f646"},"repository":{"const":"https://gitlab.com/OpenMW/openmw.git"},"tag":{"const":"openmw-0.51.0"}},"required":["repository","tag","commit"],"type":"object"}},"required":["schema_version","upstream","series","changes"],"type":"object"}
