{"changes":[{"artifact":"patches/0001-apps-openmw-cmakelists-txt.patch","artifact_sha256":"09efd0c5eec44c9d59e344c10c315e3e7f7ab35c0dc6127f8990747142be187d","base_blob":"17c4e96b16903e518958c63923e4a7cc9a7d816f","operation":"modify","order":1,"path":"apps/openmw/CMakeLists.txt","provenance_id":"openmw-exact-pin-lorkhan-package-foundation","rationale":"Link the maintained LORKHAN core and authenticated Beast transport into openmw-lib.","result_sha256":"38dc6071f989b9e7563ff2d4e1328f4d5c897491e0ae944656d83dfeed2affff","subsystem":"lua-package-registration","test_ids":["engine-integration"]},{"artifact":"overlay/apps/openmw/mwlua/lorkhanbindings.cpp","artifact_sha256":"05c02caf0be574fe83fa38156bd917c1b6f741fc7fe670bce8225b18f5b4f9cb","base_blob":null,"operation":"add","order":2,"path":"apps/openmw/mwlua/lorkhanbindings.cpp","provenance_id":"openmw-exact-pin-lorkhan-package-foundation","rationale":"Expose typed session, turn, polling, cancellation, verified media playback, and status operations without generic host capabilities.","result_sha256":"05c02caf0be574fe83fa38156bd917c1b6f741fc7fe670bce8225b18f5b4f9cb","subsystem":"lua-package-registration","test_ids":["engine-integration"]},{"artifact":"overlay/apps/openmw/mwlua/lorkhanbindings.hpp","artifact_sha256":"860e3d674d6b24d6891e8516dff4bb4075e72065ab2a95b5592b73b7b242e8d8","base_blob":null,"operation":"add","order":3,"path":"apps/openmw/mwlua/lorkhanbindings.hpp","provenance_id":"openmw-exact-pin-lorkhan-package-foundation","rationale":"Declare the context-gated LORKHAN package initializers.","result_sha256":"860e3d674d6b24d6891e8516dff4bb4075e72065ab2a95b5592b73b7b242e8d8","subsystem":"lua-package-registration","test_ids":["engine-integration"]},{"artifact":"patches/0004-apps-openmw-mwlua-luabindings-cpp.patch","artifact_sha256":"2b6fb41dc36b68f873a5bdfe16d67df0defab2d4d51702822c6441f98dedfc19","base_blob":"dc20205cbe15f17230b87cea60a6c4276972f0a6","operation":"modify","order":4,"path":"apps/openmw/mwlua/luabindings.cpp","provenance_id":"openmw-exact-pin-lorkhan-package-foundation","rationale":"Expose openmw.lorkhan only through GLOBAL and local package maps; PLAYER/CUSTOM inherit local while MENU/LOAD do not.","result_sha256":"06ffc7ac7ed70e599e10059135a61fd70481d6ad81c38703686f1bb796bb6e57","subsystem":"lua-package-registration","test_ids":["engine-integration"]},{"artifact":"patches/0005-components-lua-scriptscontainer-cpp.patch","artifact_sha256":"2316102f844f57b6378f7038679fe040fd8738064993ca11115540066e6b404f","base_blob":"8b62eb7bd4641b3a4b7450f28d2f45361a5ecaa5","operation":"modify","order":5,"path":"components/lua/scriptscontainer.cpp","provenance_id":"openmw-exact-pin-lorkhan-package-foundation","rationale":"Permit existing per-script package-loader semantics in script containers so openmw.lorkhan can be gated to CUSTOM local scripts.","result_sha256":"1130f8440155ac4091c642f2fb72b4fcf49a3fdf1fe57c40f077e08082d5324f","subsystem":"lua-package-registration","test_ids":["engine-integration"]},{"artifact":"patches/0006-apps-openmw-mwbase-soundmanager-hpp.patch","artifact_sha256":"bf5a72be92edd6165b83a9afbf73c26c2a0427673a432da4a5265bed40878905","base_blob":"9b6b579c2ffc52431a974b0a5455a3f7da7f4e3e","operation":"modify","order":6,"path":"apps/openmw/mwbase/soundmanager.hpp","provenance_id":"openmw-exact-pin-lorkhan-package-foundation","rationale":"Declare the engine-internal verified LORKHAN media stream playback seam without exposing host paths to Lua.","result_sha256":"f7cc39a911dd0532646c1bdaf71446c20483aa84bba508e40f399985b09da8c7","subsystem":"verified-media-playback","test_ids":["engine-integration"]},{"artifact":"patches/0007-apps-openmw-mwsound-ffmpegdecoder-cpp.patch","artifact_sha256":"49cbc7dc890067fb3e7bf23e30837e1c8f7be77533128b120b5638ed6c88455c","base_blob":"d780db8f075495303212c8e60b9448f9c691e341","operation":"modify","order":7,"path":"apps/openmw/mwsound/ffmpegdecoder.cpp","provenance_id":"openmw-exact-pin-lorkhan-package-foundation","rationale":"Decode an already verified native media stream so runtime downloads do not depend on the startup VFS index.","result_sha256":"aab4d701e3c758f21b6509bbcc83b69bf62fd7af9619b96955706dc3236e4f5f","subsystem":"verified-media-playback","test_ids":["engine-integration"]},{"artifact":"patches/0008-apps-openmw-mwsound-ffmpegdecoder-hpp.patch","artifact_sha256":"151b97453aa42b768c627a1f20f0f0522f7b37442caa1ce9928bd20ccd4f84e6","base_blob":"17f1301c3ed18bcc83b203850ca08ceec1244c17","operation":"modify","order":8,"path":"apps/openmw/mwsound/ffmpegdecoder.hpp","provenance_id":"openmw-exact-pin-lorkhan-package-foundation","rationale":"Declare the verified stream decoder entry point used only by the LORKHAN sound seam.","result_sha256":"0c03dfa3f0b8187f0ad2b1e9a1aa083599e34f2da6beda42616cf03177d29716","subsystem":"verified-media-playback","test_ids":["engine-integration"]},{"artifact":"patches/0009-apps-openmw-mwsound-soundmanagerimp-cpp.patch","artifact_sha256":"8f6365f722d903a0f734bcc1d6eb6a2b11541a26a39098590116c55ada242d90","base_blob":"8471dbe0beb73ba1894a5d73c117c0ab2927a68b","operation":"modify","order":9,"path":"apps/openmw/mwsound/soundmanagerimp.cpp","provenance_id":"openmw-exact-pin-lorkhan-package-foundation","rationale":"Play verified LORKHAN streams through the existing actor-positioned voice and lip-animation path with observable failure.","result_sha256":"ab65efdd1e2bf96b2309f28a26aaf7ba00fe72dd89a42c4a7d25a89194634f64","subsystem":"verified-media-playback","test_ids":["engine-integration"]},{"artifact":"patches/0010-apps-openmw-mwsound-soundmanagerimp-hpp.patch","artifact_sha256":"c580e5f956d5bafb37359bf3d38619fcd96bc5dad87177ce4030b194472e3b71","base_blob":"48ff293002779cac943d8f15daced46b982b7fa5","operation":"modify","order":10,"path":"apps/openmw/mwsound/soundmanagerimp.hpp","provenance_id":"openmw-exact-pin-lorkhan-package-foundation","rationale":"Implement the engine-internal verified LORKHAN media stream playback contract.","result_sha256":"6ab9f3701bcfae93b0e37c695529d8f5af1dbfe3c728c87b64223a78fefa0dbf","subsystem":"verified-media-playback","test_ids":["engine-integration"]},{"artifact":"patches/0011-apps-launcher-main-cpp.patch","artifact_sha256":"d2ce8048a391231f4d74b2a204a5c2fc0e10ac0c5a9663dbda43d87be146911e","base_blob":"ff8515428928ff850caf60b8abc52127b50cae8c","operation":"modify","order":11,"path":"apps/launcher/main.cpp","provenance_id":"openmw-exact-pin-lorkhan-package-foundation","rationale":"Let the LORKHAN compatibility Mod Manager load an additional OpenMW configuration directory from its command line.","result_sha256":"5c8c7010ddcb363411e5b3f2fab78d5a22e5cd153d4f1efe70b3e6b8aa6ae15a","subsystem":"launcher-profile-selection","test_ids":["engine-integration"]},{"artifact":"patches/0012-apps-launcher-maindialog-cpp.patch","artifact_sha256":"efe0ed9b7bf85ca4cd057c58c075b2206f51d54cd9bcac3de7259018a67ed362","base_blob":"38ce59f9b2279fef1a76026f7c32738037750a65","operation":"modify","order":12,"path":"apps/launcher/maindialog.cpp","provenance_id":"openmw-exact-pin-lorkhan-package-foundation","rationale":"Forward the compatibility Mod Manager's active configuration paths when it launches OpenMW.","result_sha256":"dd10ec94f4ec7938c1d01403ee0b17400dabcb6aa10fac2c12b081fd245dc400","subsystem":"launcher-profile-selection","test_ids":["engine-integration"]},{"artifact":"patches/0013-apps-openmw-mwlua-luamanagerimp-cpp.patch","artifact_sha256":"c27005400e58d56bba357cab29dffb8634050405d1844cd864fd61fd6a198aef","base_blob":"c9c39344222ec38f3a20b9e5d109783e51300196","operation":"modify","order":13,"path":"apps/openmw/mwlua/luamanagerimp.cpp","provenance_id":"openmw-exact-pin-lorkhan-package-foundation","rationale":"Expose engine-expanded dialogue response text to player-local Lua events so TTS matches the visible dialogue window. Also copy counted non-player actor deaths from the existing actorDied hook into bounded session-fenced observations, excluding the player and non-persistent zero-health record corpses.","result_sha256":"9f384e335411a66ea3c24dea774b9b70718f5b13949f66d4893a20cf9487cdd1","subsystem":"dialogue-event-bridge","test_ids":["engine-integration"]},{"artifact":"patches/0014-apps-openmw-mwbase-luamanager-hpp.patch","artifact_sha256":"1c312e5bf8309167b002962588d07cc19067d8a0569ddf8882741e76b7430155","base_blob":"bddfc3079a40c372d3725e206591fc5fa95a0ba7","operation":"modify","order":14,"path":"apps/openmw/mwbase/luamanager.hpp","provenance_id":"openmw-exact-pin-lorkhan-package-foundation","rationale":"Capture successful actor spell casts as bounded session-fenced LORKHAN Lua observations.","result_sha256":"8e736570f0b12869430ef25b94f7953eb54b1781377f0de2893a6087288195cf","subsystem":"spell-cast-event-bridge","test_ids":["engine-integration"]},{"artifact":"patches/0015-apps-openmw-mwlua-luamanagerimp-hpp.patch","artifact_sha256":"9a2c4052bb073e0552958593c76d2c8332d13ce18809f58469e3241915fb0bab","base_blob":"c1fe00d1f3821fafafa7f8c67ef7de421bbc4ec3","operation":"modify","order":15,"path":"apps/openmw/mwlua/luamanagerimp.hpp","provenance_id":"openmw-exact-pin-lorkhan-package-foundation","rationale":"Capture successful actor spell casts as bounded session-fenced LORKHAN Lua observations.","result_sha256":"4d6f002236d1a69a998d4228746f26dd87f81915b342f6410a1196215f97326f","subsystem":"spell-cast-event-bridge","test_ids":["engine-integration"]},{"artifact":"patches/0016-apps-openmw-mwmechanics-spellcasting-cpp.patch","artifact_sha256":"95a989243341f3258b05cc8b831ea5c0e1dc0f81ec0a6d0243847c61a7322274","base_blob":"c7571c35acee644e91b8b01cd0111259456ad8fe","operation":"modify","order":16,"path":"apps/openmw/mwmechanics/spellcasting.cpp","provenance_id":"openmw-exact-pin-lorkhan-package-foundation","rationale":"Capture successful actor spell casts as bounded session-fenced LORKHAN Lua observations.","result_sha256":"bc0b7b0b9de9f2866f4dcf9dfe0284f6d5ed311df89c2dcc38efb6c6203ac22a","subsystem":"spell-cast-event-bridge","test_ids":["engine-integration"]},{"artifact":"patches/0017-apps